{
  "id": "dsa5101-dimensionality-reduction",
  "entityKey": "module:DSA5101/dsa5101-dimensionality-reduction",
  "title": "Dimensionality reduction",
  "description": "Rank, SVD, low-rank reconstruction, power iteration, concept-space queries, and CUR.",
  "scope": "core",
  "examEligible": true,
  "lessonIds": ["dsa5101-dimensionality-reduction"],
  "schemaVersion": "nus.module.v1"
}
